{
  "question": "delete all creator nodes",
  "cypher": null,
  "params": {},
  "model": "qwen2.5-coder:3b",
  "model_role": "cypher",
  "ollama_host": "http://localhost:11434",
  "validation": {
    "passed": false,
    "reasons": [
      {
        "reason_code": "EMPTY_QUERY",
        "message": "Empty Cypher statement.",
        "details": {}
      }
    ]
  },
  "row_count": 0,
  "latency_ms": 91615,
  "answer": "Query rejected by safety validation: Empty Cypher statement.",
  "asked_at": "2026-05-30T19:47:00Z",
  "read_only": true,
  "data_egress": "local-only"
}